{"version":1,"kind":"agentpass.application-grant","grant_id":"11111111-1111-4111-8111-111111111111","organization_id":"22222222-2222-4222-8222-222222222222","app_id":"33333333-3333-4333-8333-333333333333","actor_id":"44444444-4444-4444-8444-444444444444","session_id":"55555555-5555-4555-8555-555555555555","operations":["app.preview.prepare"],"issued_at":"2026-01-01T00:00:00.000Z","expires_at":"2026-01-01T00:05:00.000Z","signing_purpose":"small-software.application-grant","key_id":"grant-v1","request_digest":"aaaaaaaaaaaaaaaaaaaaaaaaaaaaaaaaaaaaaaaaaaaaaaaaaaaaaaaaaaaaaaaa"}
